{
  "site": {
    "name": "My Site",
    "tagline": "A markdown-powered site",
    "url": "https://example.com",
    "logo": "/img/logo.jpg",
    "footer": "Default footer text"
  },
  "home": {
    "title": "Latest News",
    "subtitle": "Recent updates and announcements"
  },
  "posts": {
    "pageTitle": "News",
    "defaultTag": "news",
    "tags": {
      "news": { "label": "News", "color": "slategray" },
      "guide": { "label": "Guide", "color": "steelblue" },
      "update": { "label": "Update", "color": "seagreen" }
    }
  },
  "theme": {
    "background": {
      "type": "gradient",
      "gradientStart": "#35B2F5",
      "gradientEnd": "#FFFFFF"
    }
  },
  "nav": {
    "links": [
      { "type": "text", "label": "Home", "href": "/" },
      { "type": "text", "label": "About", "href": "/about" },
      {
        "type": "icon",
        "label": "Github",
        "href": "https://github.com/you",
        "icon": "/img/github.svg"
      }
    ]
  },
  "sidebar": {
    "cta": {
      "enabled": false,
      "heading": "Get Started",
      "text": "Learn more and get involved.",
      "buttonText": "Learn More",
      "buttonHref": "#"
    },
    "status": {
      "enabled": false,
      "heading": "Server Status",
      "statusLabel": "Status",
      "playersLabel": "Players Online"
    }
  },
  "status": {
    "plugin": "mock",
    "options": {
      "online": true,
      "players": 0
    }
  }
}
